{
  "schemaVersion": 1,
  "author": "claude-opus-5-5 (pep-c8-react-intake)",
  "decidedBy": "pep-content second mate (non-author reconciler)",
  "reviewedPath": "react/assessments/web-and-react-module-check/blueprint.json",
  "reviewedSha256": "5aef8b6dabd805dd894784ac8e03fbbce0e35ee1ac29b0c7f56bd99994182567",
  "decisions": [
    {
      "findingId": "react-edu-recheck-001",
      "decision": "accept",
      "rationale": "Align at objective level. Before P1's first use, add a minuted worked example plus check for the project-structure objectives it applies (file roles, component modules with imports/exports, development vs build). Before P3's first use on FT18, add one for response-driven list refresh and duplicate-submit prevention (create-edit-and-delete o2/o3). Rebalance build time inside the frozen 70-minute block. If a step cannot fit, narrow the increment to objectives actually taught, and remove those topics from its applied list. Do not rely on the Skim, the diagnostic or full topic pages.",
      "file": "evidence/react/intake.md",
      "fixedInSha256": "cd1f2ad9f06b8dbc38c97f243837cee6803be557f43303a90e92dd50cb44256b"
    },
    {
      "findingId": "react-edu-recheck-002",
      "decision": "accept",
      "rationale": "Within S33's 80-minute Build block, add explicit, checked instruction on reconciling the screen with the response and guarding duplicate submission before P3 asks for them, or narrow P3 to the objectives taught there.",
      "file": "evidence/react/intake.md",
      "fixedInSha256": "cd1f2ad9f06b8dbc38c97f243837cee6803be557f43303a90e92dd50cb44256b"
    }
  ]
}
