{
  "schemaVersion": 1,
  "author": "claude-opus-5-5 (pep-m-java-foundations-java-basics)",
  "decidedBy": "pep-content second mate (non-author reconciler)",
  "reviewedPath": "java-foundations/java-basics/arithmetic-comparison-and-logical-operators/artifact.html",
  "reviewedSha256": "035c786a429df33df62f13e3962d0c86e87ab596db58af4a0dc3d0e631609c34",
  "decisions": [
    {
      "findingId": "java-basics-sme-002",
      "decision": "accept",
      "rationale": "Qualify compound assignment for simple int examples; note the implicit cast and single left-side evaluation."
    }
  ]
}